{
  "$id": "https://vlaeg.local/federation/protocol/lock",
  "$schema": "https://vlaeg.local/federation/protocol/schemas/protocol-lock.schema.json",
  "bundleDigest": "sha256:15f88dd59e9322a6a95a8ebee6ef81a14898bb917027a105fd0ee71f2c0c8b76",
  "fileDigests": {
    "README.md": "sha256:ce2349b6e7153b885aa2aa7c80206cc129da545ec8ac8923d64eecb8236ccbef",
    "VERSION": "sha256:1575e1af4a95f12f70b4ee6a6adce8160953d93ea17dc2611b90883ccc3ad3b8",
    "core/__init__.py": "sha256:f3df0d9c728d88eb326ee443b8749903024ffa4d4b0faf567c425893a96ec80d",
    "core/parity.py": "sha256:bf580dec3ffba1205038f1b5282807f6ad379d39004770e277b9176073846067",
    "core/protocol.py": "sha256:997649f869df5046b6aab0a1fe0a872abfb0c6f9ca2a789eebe64c7a78185468",
    "manifest.json": "sha256:0c2b5ad0df291a638d259e23d4bab52aab98b83c75b5288b2f77cd2a28a0086f",
    "overlays/base.json": "sha256:a6a751704bd0c4579b3ad232377c2a9897963dc6b3e5f594b91bb0993a33cc2a",
    "schemas/protocol-lock.schema.json": "sha256:9230ab4b5d7c1761069715c02481371432e4a9f0b9e1f78dc7b9507a124380b7",
    "schemas/protocol-manifest.schema.json": "sha256:3c9bfe84bed8bc1b4bd19e36c23c366399f703a9200b66610a38bef88dedfae2",
    "schemas/protocol-overlay.schema.json": "sha256:1fdd50800c2fec2dac037c7634ab907dd5181c5c6fcdbcbef787f7c96e0c9977",
    "schemas/semantic-overlay.schema.json": "sha256:0fe317536162be64ed110f4cc0553578ba721049528db85e5d492a918ccea167",
    "templates/protocol.lock.json": "sha256:77d81fa98880e10ff1525063ba88f68534e10c131754f6c86fad56b865f081b8"
  },
  "managedFiles": [
    "README.md",
    "VERSION",
    "core/__init__.py",
    "core/parity.py",
    "core/protocol.py",
    "manifest.json",
    "overlays/base.json",
    "schemas/protocol-lock.schema.json",
    "schemas/protocol-manifest.schema.json",
    "schemas/protocol-overlay.schema.json",
    "schemas/semantic-overlay.schema.json",
    "templates/protocol.lock.json"
  ],
  "overlay": "base",
  "patches": [],
  "protocolVersion": "1.1.0",
  "semanticCore": "core/parity.py",
  "semanticOverlaySchema": "schemas/semantic-overlay.schema.json",
  "source": "federation/protocol",
  "sourceCommit": "966f159683f4586f0b937d45f694dac5983fdd73"
}
